drug_a,drug_b,severity,interaction,alternative
Scopolamine,Antihistamines,Moderate,"Increases the burden of anticholinergic side effects like drowsiness, dry mouth, blurred vision, and confusion.",Use with caution, especially in the elderly
Dimenhydrinate,Alcohol,High,"Significantly increases drowsiness and dizziness, impairing coordination and judgment.",Avoid Combination
Meclizine,Sedatives,High,"Combining with other CNS depressants like benzodiazepines or sleep aids can cause profound sedation.",Avoid Combination
Sumatriptan,Ergotamines,High,"Both are used for migraines and cause vasoconstriction. Using them within 24 hours of each other can lead to excessive blood vessel narrowing.",Do not use within 24 hours of each other
Rizatriptan,Propranolol,Moderate,"Propranolol can increase the concentration of rizatriptan. The dose of rizatriptan should be adjusted.",Lower rizatriptan dose
Zolmitriptan,MAOI,High,"MAOIs inhibit the breakdown of zolmitriptan, leading to dangerously high levels. Should not be used together or within 2 weeks of stopping an MAOI.",Never combine
Naproxen,Lisinopril,Moderate,"NSAIDs can reduce the blood pressure-lowering effect of ACE inhibitors and may increase the risk of kidney damage.",Monitor blood pressure and renal function
Celecoxib,Warfarin,Moderate,"Although Celecoxib is a COX-2 inhibitor, it can still increase the anticoagulant effect of warfarin. INR should be monitored.",Monitor INR
Meloxicam,Methotrexate,High,"Like other NSAIDs, meloxicam can increase methotrexate toxicity, especially at high doses.",Avoid Combination if possible
Diclofenac,Cyclosporine,High,"Concurrent use increases the risk of nephrotoxicity (kidney damage) from both drugs.",Monitor renal function very closely
Ketorolac,Lithium,High,"Ketorolac can significantly increase lithium levels, leading to toxicity. This combination is generally contraindicated.",Avoid Combination
Tramadol,Carbamazepine,Moderate,"Carbamazepine can increase the metabolism of tramadol, reducing its analgesic effect.",May need to adjust tramadol dose
Tapentadol,Alcohol,High,"Alcohol can accelerate the release of tapentadol from extended-release formulations, leading to a potentially fatal overdose (dose dumping).",Avoid Alcohol
Fentanyl,Grapefruit Juice,Moderate,"Grapefruit juice can increase the concentration of fentanyl, increasing the risk of respiratory depression.",Avoid Combination
Hydrocodone,Benzodiazepines,High,"This combination carries a black box warning due to the high risk of profound sedation, respiratory depression, coma, and death.",Avoid Combination
Oxycodone,Ritonavir,High,"Ritonavir can dramatically increase oxycodone levels, leading to a risk of fatal overdose.",Avoid Combination
Morphine,Gabapentin,Moderate,"Concurrent use can enhance the CNS depressant effects of both drugs, particularly sedation and dizziness.",Use with caution
Buprenorphine,Naltrexone,High,"Naltrexone is an opioid antagonist and will precipitate severe withdrawal symptoms in a patient physically dependent on buprenorphine.",Used for different stages of addiction treatment
Naloxone,Oxycodone,Info,"Naloxone is an opioid antagonist used to rapidly reverse the effects of an opioid overdose. It has no effect if opioids are not present.",Opioid overdose reversal agent
Donepezil,Oxybutynin,Moderate,"Donepezil (a cholinesterase inhibitor) and oxybutynin (an anticholinergic) have opposing mechanisms of action, which may reduce the effectiveness of both drugs.",Consult Doctor
Galantamine,Paroxetine,Moderate,"Paroxetine can inhibit the metabolism of galantamine, increasing its levels and the risk of cholinergic side effects.",Monitor for side effects
Rivastigmine,Metoclopramide,Moderate,"Both drugs can increase the risk of extrapyramidal symptoms (movement disorders).",Use with caution
Memantine,Amantadine,Moderate,"Both drugs are NMDA receptor antagonists. Combining them may increase the risk of CNS side effects like confusion, dizziness, and hallucinations.",Use with caution
Levodopa,MAOI,High,"Combining levodopa with non-selective MAOIs can cause a hypertensive crisis due to increased catecholamine levels.",Selective MAO-B inhibitors are safe
Pramipexole,Ciprofloxacin,Moderate,"Ciprofloxacin can inhibit the clearance of pramipexole, increasing its plasma concentration and risk of side effects.",Monitor for side effects
Ropinirole,Fluvoxamine,High,"Fluvoxamine is a potent inhibitor of the enzyme that metabolizes ropirole, leading to a large increase in its concentration.",Alternative SSRI or lower ropirole dose
Selegiline,Meperidine,High,"This combination can cause severe serotonin syndrome, with agitation, high fever, and convulsions. It can be fatal.",Never combine
Rasagiline,Dextromethorphan,High,"Increased risk of serotonin syndrome. Should not be used together or within 14 days of each other.",Avoid Combination
Entacapone,Dobutamine,Moderate,"Entacapone can inhibit the metabolism of drugs like dobutamine, increasing their effects on heart rate and blood pressure.",Monitor cardiovascular status
Topiramate,Oral Contraceptives,Moderate,"Topiramate (especially at doses >200mg/day) can decrease the effectiveness of estrogen-containing oral contraceptives, leading to a risk of unplanned pregnancy.",Use backup contraception
Lamotrigine,Valproic Acid,High,"Valproic acid significantly inhibits the metabolism of lamotrigine, more than doubling its concentration and greatly increasing the risk of a life-threatening rash (Stevens-Johnson syndrome).",Lamotrigine dose must be reduced significantly
Levetiracetam,Alcohol,Moderate,"Alcohol can enhance the sedative effects of levetiracetam, leading to increased drowsiness and dizziness.",Use with caution
Zonisamide,Topiramate,Moderate,"Both drugs can increase the risk of metabolic acidosis and kidney stones. Patients should be advised to stay well-hydrated.",Monitor bicarbonate levels
Metformin,Amlodipine,Safe,"No significant interaction known. This is a very common and safe combination for patients with diabetes and high blood pressure.",None
Paracetamol,Loratadine,Safe,"No interaction known. It is safe to take this non-drowsy antihistamine with paracetamol.",None
Lisinopril,Paracetamol,Safe,"No significant interaction. Paracetamol is a preferred painkiller for patients on ACE inhibitors like Lisinopril.",None
Atorvastatin,Metformin,Safe,"No interaction known. These are frequently prescribed together for patients with high cholesterol and type 2 diabetes.",None
Sertraline,Amlodipine,Safe,"No significant interaction known between this SSRI and calcium channel blocker.",None
Amoxicillin,Ibuprofen,Safe,"No direct interaction. It is generally safe to take this common antibiotic with ibuprofen for pain or fever relief during an infection.",None
Cetirizine,Paracetamol,Safe,"No interaction known. It is safe to take this antihistamine with paracetamol.",None
Omeprazole,Amlodipine,Safe,"No significant interaction known. Safe to use together.",None
Levothyroxine,Metformin,Safe,"No interaction known. Commonly used together in patients with thyroid issues and diabetes.",None
Metformin,Gliclazide,Safe,"This is a standard combination therapy for type 2 diabetes. They work in different ways to lower blood sugar.",None
Lisinopril,Amlodipine,Safe,"This is a common and effective combination for treating high blood pressure.",None
Atorvastatin,Ezetimibe,Safe,"This is a standard combination for cholesterol management. Ezetimibe works in the gut to reduce cholesterol absorption, complementing the action of statins.",None
Paracetamol,Codeine,Info,"This is a common combination painkiller (e.g., Co-codamol). Codeine is an opioid, so it can cause drowsiness and constipation. Should be used for short-term pain.",Consult Pharmacist
Aspirin,Omeprazole,Info,"Omeprazole is often prescribed alongside long-term aspirin to protect the stomach and reduce the risk of ulcers and bleeding.",Stomach protection
Albuterol,Fluticasone,Safe,"This is a standard combination in inhalers for asthma and COPD. Albuterol is a rescue bronchodilator, and fluticasone is a steroid that reduces inflammation.",Standard asthma therapy
Montelukast,Loratadine,Safe,"No interaction known. Often used together to manage allergy and asthma symptoms.",None
Fexofenadine,Pseudoephedrine,Info,"This is a common combination in allergy medications. Fexofenadine is an antihistamine, and pseudoephedrine is a decongestant.",Decongestant can raise blood pressure
Ramipril,Hydrochlorothiazide,Safe,"This is a very common combination pill for high blood pressure. The ACE inhibitor and diuretic work together effectively.",Standard hypertension therapy
Losartan,Hydrochlorothiazide,Safe,"This is a very common combination pill for high blood pressure, combining an ARB and a diuretic.",Standard hypertension therapy
Metoprolol,Amlodipine,Safe,"This combination of a beta-blocker and a calcium channel blocker is often used to treat high blood pressure and angina.",None
Gabapentin,Paracetamol,Safe,"No interaction known. It is safe to use paracetamol for pain while taking gabapentin.",None
Pregabalin,Metformin,Safe,"No interaction known. Safe to use together.",None
Tamsulosin,Finasteride,Safe,"This is a standard combination therapy for benign prostatic hyperplasia (BPH). Tamsulosin relaxes the bladder neck muscles, while finasteride shrinks the prostate.",Standard BPH therapy
Allopurinol,Paracetamol,Safe,"No interaction known. Safe to use paracetamol for pain relief if needed while taking allopurinol for gout.",None
Colchicine,Paracetamol,Safe,"No interaction known. Paracetamol can be used for pain relief during a gout attack being treated with colchicine.",None
Sertraline,Buspirone,Moderate,"Increased risk of serotonin syndrome. This combination may be used by specialists but requires careful monitoring.",Monitor for symptoms
Bupropion,SSRI,Moderate,"Bupropion can lower the seizure threshold. When combined with an SSRI, the risk may increase. Also used as an augmentation strategy in depression.",Consult Doctor
Trazodone,SSRI,Moderate,"Combining can increase the risk of serotonin syndrome and sedation. Often used together at low doses of trazodone for insomnia in patients with depression.",Monitor for symptoms and sedation
Mirtazapine,Sertraline,Moderate,"Increased risk of serotonin syndrome, although it is a common combination used by specialists for treatment-resistant depression.",Monitor for symptoms
Venlafaxine,MAOI,High,"Extremely high risk of serotonin syndrome. A 14-day washout period is required when switching between these medications.",Never combine
Duloxetine,Ibuprofen,Moderate,"Like other SNRIs/SSRIs, combining with NSAIDs increases the risk of gastrointestinal bleeding.",Consult Doctor
Escitalopram,Metoprolol,Moderate,"Escitalopram can inhibit the enzyme that metabolizes metoprolol, increasing its concentration and risk of side effects like slow heart rate.",Monitor heart rate and blood pressure
Fluoxetine,Phenytoin,High,"Fluoxetine can increase phenytoin levels, leading to toxicity. Phenytoin levels must be monitored closely.",Monitor drug levels
Paroxetine,Risperidone,High,"Paroxetine is a potent enzyme inhibitor that can significantly increase risperidone levels, increasing the risk of extrapyramidal side effects.",Alternative SSRI or lower risperidone dose
Fluvoxamine,Theophylline,High,"Fluvoxamine can dramatically increase theophylline levels, leading to a high risk of toxicity.",Alternative SSRI
Sertraline,Warfarin,Moderate,"Sertraline can increase the anticoagulant effect of warfarin. INR should be monitored closely when starting, stopping, or changing the dose of sertraline.",Monitor INR
Citalopram,Cimetidine,Moderate,"Cimetidine can increase citalopram levels, increasing the risk of side effects, including a heart rhythm problem (QT prolongation).",Use a different H2 blocker like Famotidine
Diazepam,Alcohol,High,"Significantly enhances sedative and respiratory depressant effects, leading to a high risk of overdose and accidents.",Avoid Combination
Zolpidem,Alcohol,High,"Greatly increases the risk of sleep-walking, sleep-driving, and other complex sleep behaviors, along with profound sedation.",Avoid Combination
Lorazepam,Opioids,High,"Black box warning for this combination due to the high risk of severe respiratory depression, coma, and death.",Avoid Combination
Alprazolam,Grapefruit Juice,Moderate,"Grapefruit juice can inhibit the metabolism of alprazolam, increasing its concentration and sedative effects.",Avoid or limit grapefruit juice
Clonazepam,Antihistamines,Moderate,"Combining with sedating antihistamines like diphenhydramine increases drowsiness and CNS depression.",Use non-sedating antihistamine
Temazepam,Ciprofloxacin,Moderate,"Ciprofloxacin can inhibit the metabolism of some benzodiazepines, potentially increasing their sedative effects.",Use with caution